{"$schema":"https://json-schema.org/draft/2020-12/schema","title":"Human Outcome Reporting: task-contract v1","type":"object","properties":{"schema_version":{"type":"string","enum":["1.0"]},"revision":{"type":"string","minLength":1,"maxLength":100},"task":{"type":"object","properties":{"id":{"type":"string","pattern":"^[A-Za-z0-9][A-Za-z0-9_.:-]{0,127}$","maxLength":128},"title":{"type":"string","minLength":1,"maxLength":300},"context":{"type":"string","minLength":1,"maxLength":8000},"goal":{"type":"string","minLength":1,"maxLength":8000},"type":{"type":"string","enum":["feature","bugfix","refactor","research","review","planning","operations","documentation","security","release","utility"]}},"required":["id","title","context","goal","type"],"additionalProperties":false},"approval":{"type":"object","properties":{"state":{"type":"string","enum":["proposed","confirmed"]},"by":{"type":"string","minLength":0,"maxLength":200},"record":{"type":"string","minLength":0,"maxLength":2000}},"required":["state","by","record"],"additionalProperties":false},"requirements":{"type":"array","items":{"type":"object","properties":{"id":{"type":"string","pattern":"^[A-Za-z0-9][A-Za-z0-9_.:-]{0,127}$","maxLength":128},"text":{"type":"string","minLength":1,"maxLength":8000},"source":{"type":"string","enum":["user","document","inferred"]},"source_ref":{"type":"string","minLength":0,"maxLength":2000}},"required":["id","text","source"],"additionalProperties":false},"minItems":0,"maxItems":1000},"criteria":{"type":"array","items":{"type":"object","properties":{"id":{"type":"string","pattern":"^[A-Za-z0-9][A-Za-z0-9_.:-]{0,127}$","maxLength":128},"text":{"type":"string","minLength":1,"maxLength":8000},"requirement_ids":{"type":"array","items":{"type":"string","pattern":"^[A-Za-z0-9][A-Za-z0-9_.:-]{0,127}$","maxLength":128},"minItems":0,"maxItems":1000,"uniqueItems":true},"required":{"type":"boolean"},"applicability":{"type":"string","enum":["applicable","not_applicable"]},"exclusion":{"type":"object","properties":{"reason":{"type":"string","minLength":1,"maxLength":8000},"approved_by":{"type":"string","minLength":1,"maxLength":200},"record":{"type":"string","minLength":1,"maxLength":2000}},"required":["reason","approved_by","record"],"additionalProperties":false},"verification":{"type":"array","items":{"type":"object","properties":{"id":{"type":"string","pattern":"^[A-Za-z0-9][A-Za-z0-9_.:-]{0,127}$","maxLength":128},"method":{"type":"string","enum":["automated","manual","inspection","research"]},"environment":{"type":"string","minLength":1,"maxLength":200},"expectation":{"type":"string","minLength":1,"maxLength":8000}},"required":["id","method","environment","expectation"],"additionalProperties":false},"minItems":0,"maxItems":1000}},"required":["id","text","requirement_ids","required","applicability","verification"],"additionalProperties":false},"minItems":0,"maxItems":1000},"plan_steps":{"type":"array","items":{"type":"object","properties":{"id":{"type":"string","pattern":"^[A-Za-z0-9][A-Za-z0-9_.:-]{0,127}$","maxLength":128},"title":{"type":"string","minLength":1,"maxLength":1000},"criterion_ids":{"type":"array","items":{"type":"string","pattern":"^[A-Za-z0-9][A-Za-z0-9_.:-]{0,127}$","maxLength":128},"minItems":0,"maxItems":1000,"uniqueItems":true},"depends_on":{"type":"array","items":{"type":"string","pattern":"^[A-Za-z0-9][A-Za-z0-9_.:-]{0,127}$","maxLength":128},"minItems":0,"maxItems":1000,"uniqueItems":true}},"required":["id","title","criterion_ids","depends_on"],"additionalProperties":false},"minItems":0,"maxItems":1000},"questions":{"type":"array","items":{"type":"object","properties":{"id":{"type":"string","pattern":"^[A-Za-z0-9][A-Za-z0-9_.:-]{0,127}$","maxLength":128},"text":{"type":"string","minLength":1,"maxLength":8000},"required":{"type":"boolean"}},"required":["id","text","required"],"additionalProperties":false},"minItems":0,"maxItems":1000}},"required":["schema_version","revision","task","approval","requirements","criteria","plan_steps","questions"],"additionalProperties":false}
