{"schema_version":"1.0","revision":"example-1","task":{"id":"DEMO-1","title":"Выгрузка заказов","context":"Владельцу магазина нужна выгрузка заказов за выбранный период без доступа к данным других организаций. Пример синтетический.","goal":"Дать владельцу выгрузку только его заказов за выбранные даты.","type":"feature"},"approval":{"state":"confirmed","by":"Автор учебного примера","record":"Условный контракт для демонстрации, не реальная приёмка"},"requirements":[{"id":"r1","text":"Выгрузка за выбранный период.","source":"user"},{"id":"r2","text":"Недоступность чужих заказов.","source":"user"}],"criteria":[{"id":"c1","text":"В выгрузку попадают заказы только за выбранный период.","requirement_ids":["r1"],"required":true,"applicability":"applicable","verification":[{"id":"v1","method":"manual","environment":"учебная фикстура","expectation":"Проверить границы периода."}]},{"id":"c2","text":"Пользователь не может выгрузить заказы другой организации.","requirement_ids":["r2"],"required":true,"applicability":"applicable","verification":[{"id":"v2","method":"manual","environment":"учебная фикстура","expectation":"Проверить запрос пользователя другой организации."}]}],"plan_steps":[{"id":"s1","title":"Подготовить выгрузку и проверить период.","criterion_ids":["c1"],"depends_on":[]},{"id":"s2","title":"Проверить изоляцию данных организаций.","criterion_ids":["c2"],"depends_on":["s1"]}],"questions":[]}
